Requirement Attribute,Conflicting Statements,Conflict Summary,Affected Personas
Authentication & Security,Mary Johnson: Simple login process with minimal steps and secure access to health information.  ,"The conflict arises from the need for secure access to health information (Mary Johnson) versus the requirement for minimal permissions (Robert Davis). A simple login with minimal permissions may compromise the security and access control necessary to protect sensitive health information, potentially leading to unauthorized access.","Mary Johnson, Robert Davis"
User Management,"John Miller: Customizable user interfaces based on different user profiles (elderly, caregivers, etc.).  ","The conflict arises because the need for customizable user interfaces (John Miller's requirement) may complicate the design and implementation of a one-touch feature for emergency contacts (Mary Johnson's requirement). If the interface is too customizable, it could hinder the simplicity and immediacy needed for a one-touch functionality, potentially leading to confusion or delays in emergencies.","John Miller, Mary Johnson"
Data Handling,"John Miller: Compliance with data protection laws like HIPAA and GDPR.  
Mary Johnson: Secure storage of health and personal data with user-friendly access.  
Robert Davis: Automated logging of vital signs with easy access to health data.  ","The requirement for compliance with data protection laws (John Miller) may conflict with the need for user-friendly access (Mary Johnson) and easy access to health data (Robert Davis). Compliance often necessitates strict controls and limitations on data access to protect sensitive information, which can hinder user-friendly experiences and easy accessibility. This could lead to potential conflicts in balancing privacy regulations with usability and accessibility needs.","John Miller, Mary Johnson, Robert Davis, Sarah Thompson"
Performance & Speed,"Mary Johnson: Quick response time for app features and minimal loading delays.  
Robert Davis: Quick access to features without navigating through multiple screens.  ","The requirements for quick response time and minimal loading delays may conflict with the need for real-time alerts, which require continuous monitoring of health data. This could lead to potential delays in app responsiveness if the system prioritizes continuous data processing over immediate access to features. Additionally, quick access may be challenging if the app needs to simultaneously handle real-time alerts.","Mary Johnson, Robert Davis, Sarah Thompson"
Communication & Notifications,"John Miller: Enable real-time communication between elderly users, caregivers, and medical staff.  ","John Miller's requirement for real-time communication may lead to a high volume of notifications, which conflicts with Mary Johnson's desire for customized notifications that are not overwhelming. The need for constant communication could result in frequent alerts that might overwhelm users rather than provide relevant and manageable updates.","John Miller, Mary Johnson"
Integration & APIs,John Miller: Cloud-based platform with APIs for healthcare data integration.  ,"The conflict arises because a cloud-based platform focused on healthcare data integration may not inherently support the specific APIs or protocols required for seamless integration with various wearable health devices, which often have their own proprietary systems and data formats. This could lead to challenges in ensuring that both requirements can be met simultaneously.","John Miller, Robert Davis"
Accessibility & Usability,"John Miller: Balancing simplicity for older users with complex healthcare functionalities.  
Mary Johnson: Simplified interface with large buttons and clear instructions.  
Robert Davis: Large text and straightforward navigation for easy use.  ","The conflict arises from John Miller's requirement for a balance between simplicity and complex functionalities, which could lead to a more complicated interface that may not align with Mary, Robert, and Sarah's needs for simplicity and ease of use. While the other personas prioritize a user-friendly and straightforward experience, Miller's emphasis on including complex healthcare functionalities could detract from that simplicity.","John Miller, Mary Johnson, Robert Davis, Sarah Thompson"
Automation & AI,Mary Johnson: Help feature with voice prompts or video guides to assist with tasks.  ,"The requirements are not in direct conflict but address different functionalities within the automation and AI domain. However, they could potentially compete for system resources or user attention, as both require processing power and user interaction, which may lead to a prioritization issue in a constrained system environment.","Mary Johnson, Robert Davis"
Customization,John Miller: User interfaces customizable based on different user profiles.  ,"The conflict exists because John Miller's requirement focuses on customizing the user interface based on user profiles, which may imply a more structured and uniform approach to customization. In contrast, Mary Johnson's requirement emphasizes individual personalization of notifications and features, which suggests a more flexible and potentially unstructured customization approach. These differing focuses on the type and scope of customization can lead to conflicts in design and implementation strategies.","John Miller, Mary Johnson"
Device Compatibility,"John Miller: Mobile app development for both Android and iOS devices.  
Mary Johnson: Compatible with basic smartphones and tablets.  
Robert Davis: Tablet with a large screen and wearable health devices.  ","The conflict arises from the varying specifications of devices each persona requires. John Miller specifically mentions the need for both Android and iOS mobile app development, which may not align with Mary Johnson's emphasis on ""basic"" smartphones and tablets, potentially indicating limitations on capability or performance. Additionally, Robert Davis’s requirement for large screen tablets and wearable health devices introduces further complexity that may not be addressed by the broader requirements of the other personas.","John Miller, Mary Johnson, Robert Davis, Sarah Thompson"
Security & Compliance,"John Miller: Ensure compliance with data protection laws like HIPAA and GDPR.  
Mary Johnson: Adherence to privacy regulations for personal health data.  ","The requirements from John Miller are broad, focusing on compliance with specific data protection laws (HIPAA and GDPR), while Mary Johnson's requirement is more specific to personal health data without explicitly mentioning those laws. Robert Davis's requirement similarly emphasizes safety but doesn't specify the laws either. This could lead to conflicts in prioritizing compliance measures across different regulations and types of data.","John Miller, Mary Johnson, Robert Davis"
Reliability & Fault Tolerance,"Mary Johnson: Consistent performance with recovery options for errors.  
Robert Davis: Reliable performance in areas with poor internet connectivity.  ","The conflict arises because consistent performance with recovery options may require a certain level of connectivity and system resources that might not be available in areas with poor internet connectivity (Robert's requirement). Additionally, providing immediate alerts for emergencies (Sarah's requirement) may necessitate a different prioritization of system resources, potentially conflicting with the need for recovery options or consistent performance (Mary's requirement).","Mary Johnson, Robert Davis, Sarah Thompson"
Maintainability & Upgrades,"John Miller: Constant updates and compliance requirements in healthcare regulations.  
Mary Johnson: Easy updates that do not disrupt usability.  ","The conflict arises because John Miller's requirement for constant updates to meet healthcare regulations may lead to frequent changes that could disrupt usability, which Mary Johnson aims to avoid. Additionally, the need for constant updates may also result in excessive prompts that Robert Davis wants to minimize. Therefore, the requirements suggest a tension between the need for compliance and the desire for a seamless user experience.","John Miller, Mary Johnson, Robert Davis"
Usability & UX,"John Miller: Testing the app with users who have limited technical proficiency.  
Mary Johnson: Intuitive design that minimizes complexity and frustration.  
Robert Davis: Guided setup process with clear instructions and easy-to-use interface.  ","The conflict arises from the need to accommodate users with limited technical proficiency (John Miller) while also designing an intuitive interface that minimizes complexity (Mary Johnson). Users with limited technical skills may require more detailed guidance, which could potentially complicate the user experience and contradict the goal of minimizing complexity. Additionally, the emphasis on a user-friendly design (Sarah Thompson) may clash with the need for more intricate support mechanisms that some users require, as highlighted by Robert Davis's requirement for a guided setup process.","John Miller, Mary Johnson, Robert Davis, Sarah Thompson"
